{
  "$schema": "https://json-schema.org/draft/2020-12/schema",
  "$id": "urn:structural-codes:schema:asset-manifest:v2",
  "title": "Structural Codes canonical asset manifest v2",
  "type": "object",
  "additionalProperties": false,
  "required": [
    "$schema",
    "schemaVersion",
    "recordType",
    "document",
    "section",
    "sourceId",
    "status",
    "formulas",
    "tables",
    "figures"
  ],
  "properties": {
    "$schema": {
      "type": "string",
      "const": "urn:structural-codes:schema:asset-manifest:v2"
    },
    "schemaVersion": {
      "type": "string",
      "const": "2.0.0-alpha.2"
    },
    "recordType": {
      "type": "string",
      "const": "asset-manifest"
    },
    "document": {
      "type": "string",
      "enum": [
        "ntc2018",
        "circ2019"
      ]
    },
    "section": {
      "type": "string",
      "minLength": 1
    },
    "sourceId": {
      "type": "string",
      "minLength": 1
    },
    "status": {
      "type": "string",
      "enum": [
        "draft",
        "verified"
      ]
    },
    "formulas": {
      "type": "array",
      "uniqueItems": true,
      "items": {
        "$ref": "#/$defs/formula"
      }
    },
    "tables": {
      "type": "array",
      "uniqueItems": true,
      "items": {
        "$ref": "#/$defs/table"
      }
    },
    "figures": {
      "type": "array",
      "uniqueItems": true,
      "items": {
        "$ref": "#/$defs/figure"
      }
    }
  },
  "$defs": {
    "assetId": {
      "type": "string",
      "pattern": "^urn:structural-codes:it:asset:(formula|table|figure):[a-z0-9][a-z0-9:._-]*$"
    },
    "unitId": {
      "type": "string",
      "pattern": "^urn:structural-codes:it:unit:[a-z0-9][a-z0-9:._-]*$"
    },
    "region": {
      "type": "object",
      "additionalProperties": false,
      "required": [
        "coordinateSystem",
        "x",
        "y",
        "width",
        "height"
      ],
      "properties": {
        "coordinateSystem": {
          "type": "string",
          "const": "pdf-points-top-left"
        },
        "x": {
          "type": "number",
          "minimum": 0
        },
        "y": {
          "type": "number",
          "minimum": 0
        },
        "width": {
          "type": "number",
          "exclusiveMinimum": 0
        },
        "height": {
          "type": "number",
          "exclusiveMinimum": 0
        }
      }
    },
    "assetCore": {
      "type": "object",
      "required": [
        "id",
        "unitId",
        "officialNumber",
        "pdfPage"
      ],
      "properties": {
        "id": {
          "$ref": "#/$defs/assetId"
        },
        "unitId": {
          "$ref": "#/$defs/unitId"
        },
        "officialNumber": {
          "type": [
            "string",
            "null"
          ]
        },
        "pdfPage": {
          "type": "integer",
          "minimum": 1
        }
      }
    },
    "inlineSegment": {
      "oneOf": [
        {
          "type": "object",
          "additionalProperties": false,
          "required": [
            "kind",
            "value"
          ],
          "properties": {
            "kind": {
              "const": "text"
            },
            "value": {
              "type": "string",
              "minLength": 1
            }
          }
        },
        {
          "type": "object",
          "additionalProperties": false,
          "required": [
            "kind",
            "value"
          ],
          "properties": {
            "kind": {
              "const": "em-underline"
            },
            "value": {
              "type": "string",
              "minLength": 1
            }
          }
        },
        {
          "type": "object",
          "additionalProperties": false,
          "required": [
            "kind",
            "value"
          ],
          "properties": {
            "kind": {
              "const": "underline"
            },
            "value": {
              "type": "string",
              "minLength": 1
            }
          }
        },
        {
          "type": "object",
          "additionalProperties": false,
          "required": [
            "kind",
            "value"
          ],
          "properties": {
            "kind": {
              "const": "strong-em"
            },
            "value": {
              "type": "string",
              "minLength": 1
            }
          }
        },
        {
          "type": "object",
          "additionalProperties": false,
          "required": [
            "kind",
            "value"
          ],
          "properties": {
            "kind": {
              "const": "strong-underline"
            },
            "value": {
              "type": "string",
              "minLength": 1
            }
          }
        },
        {
          "type": "object",
          "additionalProperties": false,
          "required": [
            "kind",
            "value"
          ],
          "properties": {
            "kind": {
              "const": "em"
            },
            "value": {
              "type": "string",
              "minLength": 1
            }
          }
        },
        {
          "type": "object",
          "additionalProperties": false,
          "required": [
            "kind",
            "value"
          ],
          "properties": {
            "kind": {
              "const": "strong"
            },
            "value": {
              "type": "string",
              "minLength": 1
            }
          }
        },
        {
          "type": "object",
          "additionalProperties": false,
          "required": [
            "kind",
            "value",
            "latex"
          ],
          "properties": {
            "kind": {
              "const": "math"
            },
            "value": {
              "type": "string",
              "minLength": 1
            },
            "latex": {
              "type": "string",
              "minLength": 1
            }
          }
        }
      ]
    },
    "formula": {
      "allOf": [
        {
          "$ref": "#/$defs/assetCore"
        },
        {
          "type": "object",
          "additionalProperties": false,
          "required": [
            "id",
            "unitId",
            "officialNumber",
            "pdfPage",
            "latex"
          ],
          "properties": {
            "id": {
              "type": "string",
              "pattern": "^urn:structural-codes:it:asset:formula:[a-z0-9][a-z0-9:._-]*$"
            },
            "unitId": {
              "$ref": "#/$defs/unitId"
            },
            "officialNumber": {
              "type": [
                "string",
                "null"
              ]
            },
            "pdfPage": {
              "type": "integer",
              "minimum": 1
            },
            "latex": {
              "type": "string",
              "minLength": 1
            }
          }
        }
      ]
    },
    "tableCell": {
      "type": "object",
      "additionalProperties": false,
      "required": [
        "text"
      ],
      "properties": {
        "text": {
          "type": "string"
        },
        "latex": {
          "type": "string",
          "minLength": 1
        },
        "inline": {
          "type": "array",
          "minItems": 1,
          "items": {
            "$ref": "#/$defs/inlineSegment"
          }
        },
        "image": {
          "type": "object",
          "additionalProperties": false,
          "required": [
            "imagePath",
            "alt",
            "sha256",
            "region"
          ],
          "properties": {
            "imagePath": {
              "type": "string",
              "pattern": "^figures/(ntc2018|circ2019)/[a-z0-9._-]+\\.png$"
            },
            "alt": {
              "type": "string",
              "minLength": 1
            },
            "sha256": {
              "type": "string",
              "pattern": "^[a-f0-9]{64}$"
            },
            "region": {
              "$ref": "#/$defs/region"
            }
          }
        },
        "colSpan": {
          "type": "integer",
          "minimum": 1,
          "default": 1
        },
        "rowSpan": {
          "type": "integer",
          "minimum": 1,
          "default": 1
        },
        "strong": {
          "type": "boolean",
          "default": false
        },
        "align": {
          "type": "string",
          "enum": [
            "left",
            "center",
            "right"
          ]
        },
        "noWrap": {
          "type": "boolean",
          "default": false
        },
        "header": {
          "type": "boolean",
          "default": true
        },
        "verticalText": {
          "type": "boolean",
          "default": false
        },
        "shade": {
          "type": "string",
          "enum": [
            "gray"
          ]
        },
        "spacer": {
          "type": "boolean",
          "default": false
        },
        "subrowIndent": {
          "type": "boolean",
          "default": false
        },
        "subrowLabel": {
          "type": "boolean",
          "default": false
        }
      }
    },
    "tableRow": {
      "type": "array",
      "minItems": 1,
      "items": {
        "$ref": "#/$defs/tableCell"
      }
    },
    "table": {
      "allOf": [
        {
          "$ref": "#/$defs/assetCore"
        },
        {
          "type": "object",
          "additionalProperties": false,
          "required": [
            "id",
            "unitId",
            "officialNumber",
            "pdfPage",
            "caption",
            "columnCount",
            "headers",
            "rows",
            "notes"
          ],
          "properties": {
            "id": {
              "type": "string",
              "pattern": "^urn:structural-codes:it:asset:table:[a-z0-9][a-z0-9:._-]*$"
            },
            "unitId": {
              "$ref": "#/$defs/unitId"
            },
            "officialNumber": {
              "type": [
                "string",
                "null"
              ]
            },
            "pdfPage": {
              "type": "integer",
              "minimum": 1
            },
            "caption": {
              "type": [
                "string",
                "null"
              ]
            },
            "hideLabel": {
              "type": "boolean"
            },
            "captionInline": {
              "type": "array",
              "minItems": 1,
              "items": {
                "$ref": "#/$defs/inlineSegment"
              }
            },
            "columnCount": {
              "type": "integer",
              "minimum": 1
            },
            "columnWidths": {
              "type": "array",
              "minItems": 1,
              "items": {
                "type": "number",
                "exclusiveMinimum": 0
              }
            },
            "footerColumnCount": {
              "type": "integer",
              "minimum": 1
            },
            "footerColumnWidths": {
              "type": "array",
              "minItems": 1,
              "items": {
                "type": "number",
                "exclusiveMinimum": 0
              }
            },
            "headers": {
              "type": "array",
              "minItems": 0,
              "items": {
                "$ref": "#/$defs/tableRow"
              }
            },
            "rows": {
              "type": "array",
              "minItems": 1,
              "items": {
                "$ref": "#/$defs/tableRow"
              }
            },
            "footerRows": {
              "type": "array",
              "minItems": 1,
              "items": {
                "$ref": "#/$defs/tableRow"
              }
            },
            "notes": {
              "type": "array",
              "items": {
                "type": "string",
                "minLength": 1
              }
            },
            "notesInline": {
              "type": "array",
              "items": {
                "type": "array",
                "minItems": 1,
                "items": {
                  "$ref": "#/$defs/inlineSegment"
                }
              }
            }
          }
        }
      ]
    },
    "figure": {
      "allOf": [
        {
          "$ref": "#/$defs/assetCore"
        },
        {
          "type": "object",
          "additionalProperties": false,
          "required": [
            "id",
            "unitId",
            "officialNumber",
            "pdfPage",
            "caption",
            "alt",
            "imagePath",
            "region",
            "sha256"
          ],
          "properties": {
            "id": {
              "type": "string",
              "pattern": "^urn:structural-codes:it:asset:figure:[a-z0-9][a-z0-9:._-]*$"
            },
            "unitId": {
              "$ref": "#/$defs/unitId"
            },
            "officialNumber": {
              "type": "string",
              "minLength": 1
            },
            "pdfPage": {
              "type": "integer",
              "minimum": 1
            },
            "caption": {
              "type": [
                "string",
                "null"
              ]
            },
            "captionInline": {
              "type": "array",
              "minItems": 1,
              "items": {
                "$ref": "#/$defs/inlineSegment"
              }
            },
            "alt": {
              "type": "string",
              "minLength": 1
            },
            "imagePath": {
              "type": "string",
              "pattern": "^figures/(ntc2018|circ2019)/[a-z0-9._-]+\\.png$"
            },
            "region": {
              "$ref": "#/$defs/region"
            },
            "additionalSourceRegions": {
              "type": "array",
              "minItems": 1,
              "items": {
                "type": "object",
                "additionalProperties": false,
                "required": [
                  "pdfPage",
                  "region"
                ],
                "properties": {
                  "pdfPage": {
                    "type": "integer",
                    "minimum": 1
                  },
                  "region": {
                    "$ref": "#/$defs/region"
                  }
                }
              }
            },
            "displayScale": {
              "type": "number",
              "exclusiveMinimum": 0
            },
            "sha256": {
              "type": "string",
              "pattern": "^[a-f0-9]{64}$"
            }
          }
        }
      ]
    }
  }
}
