{
  "$schema": "urn:structural-codes:schema:asset-manifest:v2",
  "schemaVersion": "2.0.0-alpha.2",
  "recordType": "asset-manifest",
  "document": "circ2019",
  "section": "C4.2-step2r",
  "sourceId": "circ-7-2019",
  "status": "verified",
  "formulas": [
    {
      "id": "urn:structural-codes:it:asset:formula:circ2019:c4.2.100",
      "unitId": "urn:structural-codes:it:unit:circ2019:c4.2.4.1.4.6",
      "officialNumber": "C4.2.100",
      "pdfPage": 134,
      "latex": "\\Delta\\sigma_{C,\\mathrm{red}}=k_s\\cdot\\Delta\\sigma_C"
    }
  ],
  "tables": [],
  "figures": []
}
