{
  "$schema": "urn:structural-codes:schema:asset-manifest:v2",
  "schemaVersion": "2.0.0-alpha.2",
  "recordType": "asset-manifest",
  "document": "ntc2018",
  "section": "7.4-step2",
  "sourceId": "gu-so8-2018-ntc",
  "status": "verified",
  "formulas": [
    {
      "id": "urn:structural-codes:it:asset:formula:ntc2018:7.4.13",
      "unitId": "urn:structural-codes:it:unit:ntc2018:7.4.4.5.1",
      "officialNumber": "7.4.13",
      "pdfPage": 234,
      "latex": "h_{cr}=\\max\\left(l_w,\\frac{h_w}{6}\\right)\\quad\\text{purché}\\quad h_{cr}\\le\\begin{cases}2\\cdot l_w\\\\h_s&\\text{per }n\\le6\\text{ piani}\\\\2\\cdot h_s&\\text{per }n\\ge7\\text{ piani}\\end{cases}"
    },
    {
      "id": "urn:structural-codes:it:asset:formula:ntc2018:7.4.14",
      "unitId": "urn:structural-codes:it:unit:ntc2018:7.4.4.5.1",
      "officialNumber": "7.4.14",
      "pdfPage": 234,
      "latex": "1{,}5\\le q\\cdot\\sqrt{\\left(\\frac{\\gamma_{Rd}}{q}\\cdot\\frac{M_{Rd}}{M_{Ed}}\\right)^2+0{,}1\\cdot\\left(\\frac{S_e(T_C)}{S_e(T_1)}\\right)^2}\\le q\\quad\\text{per pareti snelle}"
    },
    {
      "id": "urn:structural-codes:it:asset:formula:ntc2018:7.4.15",
      "unitId": "urn:structural-codes:it:unit:ntc2018:7.4.4.5.1",
      "officialNumber": "7.4.15",
      "pdfPage": 234,
      "latex": "\\gamma_{Rd}\\cdot\\frac{M_{Rd}}{M_{Ed}}\\le q\\quad\\text{per pareti tozze}"
    },
    {
      "id": "urn:structural-codes:it:asset:formula:ntc2018:7.4.16",
      "unitId": "urn:structural-codes:it:unit:ntc2018:7.4.4.5.1",
      "officialNumber": "7.4.16",
      "pdfPage": 235,
      "latex": "V_{Ed}\\le V_{Rd,c}+0{,}75\\cdot\\rho_h\\cdot f_{yd,h}\\cdot b_w\\cdot\\alpha_s\\cdot l_w"
    },
    {
      "id": "urn:structural-codes:it:asset:formula:ntc2018:7.4.17",
      "unitId": "urn:structural-codes:it:unit:ntc2018:7.4.4.5.1",
      "officialNumber": "7.4.17",
      "pdfPage": 235,
      "latex": "\\rho_h\\cdot f_{yd,h}\\cdot b_w\\cdot z\\le\\rho_v\\cdot f_{yd,v}\\cdot b_w\\cdot z+\\min N_{Ed}"
    },
    {
      "id": "urn:structural-codes:it:asset:formula:ntc2018:7.4.18",
      "unitId": "urn:structural-codes:it:unit:ntc2018:7.4.4.5.1",
      "officialNumber": "7.4.18",
      "pdfPage": 235,
      "latex": "V_{Ed}\\le V_{Rd,S}"
    },
    {
      "id": "urn:structural-codes:it:asset:formula:ntc2018:7.4.19",
      "unitId": "urn:structural-codes:it:unit:ntc2018:7.4.4.5.1",
      "officialNumber": "7.4.19",
      "pdfPage": 235,
      "latex": "V_{Rd,S}=V_{dd}+V_{id}+V_{fd}"
    },
    {
      "id": "urn:structural-codes:it:asset:formula:ntc2018:7.4.20",
      "unitId": "urn:structural-codes:it:unit:ntc2018:7.4.4.5.1",
      "officialNumber": "7.4.20",
      "pdfPage": 235,
      "latex": "V_{dd}=\\min\\begin{cases}1{,}3\\cdot\\sum A_{sj}\\cdot\\sqrt{f_{cd}\\cdot f_{yd}}\\\\0{,}25\\cdot f_{yd}\\cdot\\sum A_{sj}\\end{cases}"
    },
    {
      "id": "urn:structural-codes:it:asset:formula:ntc2018:7.4.21",
      "unitId": "urn:structural-codes:it:unit:ntc2018:7.4.4.5.1",
      "officialNumber": "7.4.21",
      "pdfPage": 235,
      "latex": "V_{id}=f_{yd}\\cdot\\sum A_{si}\\cdot\\cos(\\phi_i)"
    },
    {
      "id": "urn:structural-codes:it:asset:formula:ntc2018:7.4.22",
      "unitId": "urn:structural-codes:it:unit:ntc2018:7.4.4.5.1",
      "officialNumber": "7.4.22",
      "pdfPage": 236,
      "latex": "V_{fd}=\\min\\begin{cases}\\mu_f\\cdot\\left[\\left(\\sum A_{sj}\\cdot f_{yd}+N_{Ed}\\right)\\cdot\\xi+M_{Ed}/z\\right]\\\\0{,}5\\cdot\\eta\\cdot f_{cd}\\cdot\\xi\\cdot l_w\\cdot b_{wo}\\end{cases}"
    },
    {
      "id": "urn:structural-codes:it:asset:formula:ntc2018:7.4.23",
      "unitId": "urn:structural-codes:it:unit:ntc2018:7.4.4.6",
      "officialNumber": "7.4.23",
      "pdfPage": 237,
      "latex": "V_{Ed}\\le f_{ctd}\\cdot b\\cdot d"
    },
    {
      "id": "urn:structural-codes:it:asset:formula:ntc2018:7.4.24",
      "unitId": "urn:structural-codes:it:unit:ntc2018:7.4.4.6",
      "officialNumber": "7.4.24",
      "pdfPage": 237,
      "latex": "V_{iE}\\le2\\cdot A_s\\cdot f_{yd}\\cdot\\operatorname{sen}(\\phi)"
    }
  ],
  "tables": [],
  "figures": [
    {
      "id": "urn:structural-codes:it:asset:figure:ntc2018:7.4.3",
      "unitId": "urn:structural-codes:it:unit:ntc2018:7.4.4.5.1",
      "officialNumber": "7.4.3",
      "pdfPage": 233,
      "caption": "Fig. 7.4.3 – Sezioni resistenti delle pareti semplici e composte (la freccia indica la direzione del sisma)",
      "alt": "Fig. 7.4.3 – Sezioni resistenti delle pareti semplici e composte (la freccia indica la direzione del sisma)",
      "imagePath": "figures/ntc2018/fig7.4.3.png",
      "region": {
        "coordinateSystem": "pdf-points-top-left",
        "x": 85,
        "y": 215,
        "width": 430,
        "height": 241.155
      },
      "sha256": "ddcce943a8e51af4d3352a8f620357b7d83d7bf014060de5730673d194ac7073",
      "captionInline": [
        {
          "kind": "strong",
          "value": "Fig. 7.4.3 – "
        },
        {
          "kind": "em",
          "value": "Sezioni resistenti delle pareti semplici e composte (la freccia indica la direzione del sisma)"
        }
      ]
    },
    {
      "id": "urn:structural-codes:it:asset:figure:ntc2018:7.4.4",
      "unitId": "urn:structural-codes:it:unit:ntc2018:7.4.4.5.1",
      "officialNumber": "7.4.4",
      "pdfPage": 234,
      "caption": "Fig. 7.4.4 – Traslazione del diagramma dei momenti flettenti per strutture a pareti e strutture miste",
      "alt": "Fig. 7.4.4 – Traslazione del diagramma dei momenti flettenti per strutture a pareti e strutture miste",
      "imagePath": "figures/ntc2018/fig7.4.4.png",
      "region": {
        "coordinateSystem": "pdf-points-top-left",
        "x": 120,
        "y": 95,
        "width": 360,
        "height": 190.8
      },
      "sha256": "f02ee4b8140ec19d70ec4fe735894babfba7e4194566fdbdb16358fafc9918db",
      "captionInline": [
        {
          "kind": "strong",
          "value": "Fig. 7.4.4 – "
        },
        {
          "kind": "em",
          "value": "Traslazione del diagramma dei momenti flettenti per strutture a pareti e strutture miste"
        }
      ]
    },
    {
      "id": "urn:structural-codes:it:asset:figure:ntc2018:7.4.5",
      "unitId": "urn:structural-codes:it:unit:ntc2018:7.4.4.5.1",
      "officialNumber": "7.4.5",
      "pdfPage": 235,
      "caption": "Fig. 7.4.5 – Diagramma di inviluppo delle forze di taglio nelle pareti di strutture miste",
      "alt": "Fig. 7.4.5 – Diagramma di inviluppo delle forze di taglio nelle pareti di strutture miste",
      "imagePath": "figures/ntc2018/fig7.4.5.png",
      "region": {
        "coordinateSystem": "pdf-points-top-left",
        "x": 165,
        "y": 85,
        "width": 275,
        "height": 191.252
      },
      "sha256": "d974613d323757572cfb74be984acf8ec40be2aaf6ab99fdcbb15c12f9f12397",
      "captionInline": [
        {
          "kind": "strong",
          "value": "Fig. 7.4.5 – "
        },
        {
          "kind": "em",
          "value": "Diagramma di inviluppo delle forze di taglio nelle pareti di strutture miste"
        }
      ]
    },
    {
      "id": "urn:structural-codes:it:asset:figure:ntc2018:7.4.6",
      "unitId": "urn:structural-codes:it:unit:ntc2018:7.4.4.5.2",
      "officialNumber": "7.4.6",
      "pdfPage": 236,
      "caption": "Fig. 7.4.6 – Elementi di bordo di una parete, diagramma delle corrispondenti curvature, schema esemplificativo delle armature di confinamento",
      "alt": "Fig. 7.4.6 – Elementi di bordo di una parete, diagramma delle corrispondenti curvature, schema esemplificativo delle armature di confinamento",
      "imagePath": "figures/ntc2018/fig7.4.6.png",
      "region": {
        "coordinateSystem": "pdf-points-top-left",
        "x": 160,
        "y": 400,
        "width": 275,
        "height": 158.137
      },
      "sha256": "7b1992c5a635090dec5bd02dbf0ecf123c6ce541002e7803e1017ff7e30fd65e",
      "captionInline": [
        {
          "kind": "strong",
          "value": "Fig. 7.4.6 – "
        },
        {
          "kind": "em",
          "value": "Elementi di bordo di una parete, diagramma delle corrispondenti curvature, schema esemplificativo delle armature di confinamento"
        }
      ]
    }
  ]
}
