{
  "$schema": "urn:structural-codes:schema:asset-manifest:v2",
  "schemaVersion": "2.0.0-alpha.2",
  "recordType": "asset-manifest",
  "document": "circ2019",
  "section": "C8.7-step1a",
  "sourceId": "circ-7-2019",
  "status": "verified",
  "formulas": [
    {
      "id": "urn:structural-codes:it:asset:formula:circ2019:c8.7.1.1",
      "unitId": "urn:structural-codes:it:unit:circ2019:c8.7.1.2.1.1",
      "officialNumber": "C8.7.1.1",
      "pdfPage": 273,
      "latex": "\\alpha_0=\\frac{\\sum_{k=1}^{N}P_k\\delta_{P_y,k}-\\sum_{k=1}^{m}F_k\\delta_{F,k}+L_i}{\\sum_{k=1}^{N}(P_k+Q_k)\\delta_{PQ_x,k}}"
    },
    {
      "id": "urn:structural-codes:it:asset:formula:circ2019:c8.7.1.2",
      "unitId": "urn:structural-codes:it:unit:circ2019:c8.7.1.2.1.1",
      "officialNumber": "C8.7.1.2",
      "pdfPage": 273,
      "latex": "F=0.4\\,n(n+1)\\,\\Phi\\,\\mu\\,l^2\\,t_s\\,W"
    },
    {
      "id": "urn:structural-codes:it:asset:formula:circ2019:c8.7.1.3",
      "unitId": "urn:structural-codes:it:unit:circ2019:c8.7.1.2.1.3",
      "officialNumber": "C8.7.1.3",
      "pdfPage": 274,
      "latex": "a=\\frac{\\alpha(d_C)g}{e^*FC}"
    },
    {
      "id": "urn:structural-codes:it:asset:formula:circ2019:c8.7.1.4",
      "unitId": "urn:structural-codes:it:unit:circ2019:c8.7.1.2.1.3",
      "officialNumber": "C8.7.1.4",
      "pdfPage": 274,
      "latex": "d=d_C\\frac{\\sum_{k=1}^{N}(P_k+Q_k)\\delta_{PQ_x,K}^{2}}{\\delta_{Cx}\\sum_{k=1}^{N}(P_k+Q_k)\\delta_{PQ_x,K}}"
    },
    {
      "id": "urn:structural-codes:it:asset:formula:circ2019:c8.7.1.5",
      "unitId": "urn:structural-codes:it:unit:circ2019:c8.7.1.2.1.3",
      "officialNumber": "C8.7.1.5",
      "pdfPage": 274,
      "latex": "e^*=\\frac{\\left[\\sum_{k=1}^{N}(P_k+Q_k)\\delta_{PQ_x,k}\\right]^2}{\\left[\\sum_{k=1}^{N}(P_k+Q_k)\\right]\\left[\\sum_{k=1}^{N}(P_k+Q_k)\\delta_{PQ_x,k}^{2}\\right]}"
    },
    {
      "id": "urn:structural-codes:it:asset:formula:circ2019:c8.7.1.6",
      "unitId": "urn:structural-codes:it:unit:circ2019:c8.7.1.2.1.3",
      "officialNumber": "C8.7.1.6",
      "pdfPage": 274,
      "latex": "a=\\frac{4\\pi^2}{T_0^2}d"
    },
    {
      "id": "urn:structural-codes:it:asset:formula:circ2019:c8.7.1.7",
      "unitId": "urn:structural-codes:it:unit:circ2019:c8.7.1.2.1.3",
      "officialNumber": "C8.7.1.7",
      "pdfPage": 274,
      "latex": "T_0=\\kappa\\lambda L\\sqrt{\\frac{W}{Eg}}"
    }
  ],
  "tables": [],
  "figures": []
}
