{
  "$schema": "urn:structural-codes:schema:asset-manifest:v2",
  "schemaVersion": "2.0.0-alpha.2",
  "recordType": "asset-manifest",
  "document": "ntc2018",
  "section": "core-figure-placeholders",
  "sourceId": "gu-so8-2018-ntc",
  "status": "verified",
  "formulas": [],
  "tables": [],
  "figures": [
    {
      "id": "urn:structural-codes:it:asset:figure:ntc2018:3.3.1",
      "unitId": "urn:structural-codes:it:unit:ntc2018:3.3.1",
      "officialNumber": "3.3.1",
      "pdfPage": 57,
      "caption": "3.3.1 - Mappa delle zone in cui è suddiviso il territorio italiano",
      "alt": "Mappa delle nove zone del vento in cui è suddiviso il territorio italiano.",
      "imagePath": "figures/ntc2018/fig3.3.1.png",
      "region": {
        "coordinateSystem": "pdf-points-top-left",
        "x": 223,
        "y": 98,
        "width": 149.333,
        "height": 165.333
      },
      "sha256": "f1e0f6c00bb9a794693d0b9a309154f094ae824621807a549adba84cd6ccb999"
    },
    {
      "id": "urn:structural-codes:it:asset:figure:ntc2018:3.3.2",
      "unitId": "urn:structural-codes:it:unit:ntc2018:3.3.7",
      "officialNumber": "3.3.2",
      "pdfPage": 59,
      "caption": "3.3.2 - Definizione delle categorie di esposizione",
      "alt": "Schemi per l'assegnazione delle categorie di esposizione nelle zone del vento 1-9.",
      "imagePath": "figures/ntc2018/fig3.3.2.png",
      "region": {
        "coordinateSystem": "pdf-points-top-left",
        "x": 154,
        "y": 350,
        "width": 286.333,
        "height": 261.333
      },
      "sha256": "c5dc8ff5b56968b086f40484db663502ed5c46c98a25e4a88d282151ca569766"
    },
    {
      "id": "urn:structural-codes:it:asset:figure:ntc2018:3.3.3",
      "unitId": "urn:structural-codes:it:unit:ntc2018:3.3.7",
      "officialNumber": "3.3.3",
      "pdfPage": 60,
      "caption": "3.3.3 - Andamento del coefficiente di esposizione ce in funzione dell’altezza sul suolo (per ct = 1)",
      "captionInline": [
        {
          "kind": "text",
          "value": "Andamento del coefficiente di esposizione "
        },
        {
          "kind": "math",
          "value": "ce",
          "latex": "c_e"
        },
        {
          "kind": "text",
          "value": " in funzione dell’altezza sul suolo (per "
        },
        {
          "kind": "math",
          "value": "ct = 1",
          "latex": "c_t=1"
        },
        {
          "kind": "text",
          "value": ")"
        }
      ],
      "alt": "Grafico del coefficiente di esposizione in funzione dell'altezza per le categorie I-V.",
      "imagePath": "figures/ntc2018/fig3.3.3.png",
      "region": {
        "coordinateSystem": "pdf-points-top-left",
        "x": 191,
        "y": 90,
        "width": 221.667,
        "height": 173.667
      },
      "sha256": "c07665099311230e085c9b9f4c62c461c1a2494bc9d8b075edfba5c8524848eb"
    },
    {
      "id": "urn:structural-codes:it:asset:figure:ntc2018:3.4.1",
      "unitId": "urn:structural-codes:it:unit:ntc2018:3.4.2",
      "officialNumber": "3.4.1",
      "pdfPage": 61,
      "caption": "3.4.1 - Zone di carico della neve",
      "alt": "Mappa delle tre zone italiane di carico della neve al suolo.",
      "imagePath": "figures/ntc2018/fig3.4.1.png",
      "region": {
        "coordinateSystem": "pdf-points-top-left",
        "x": 164.667,
        "y": 385,
        "width": 273.667,
        "height": 332.333
      },
      "sha256": "a5005d1c982df526722bbbb7e1fb4d4be4f0392a979fae0da17d888827364268"
    },
    {
      "id": "urn:structural-codes:it:asset:figure:ntc2018:3.4.2",
      "unitId": "urn:structural-codes:it:unit:ntc2018:3.4.3.2",
      "officialNumber": "3.4.2",
      "pdfPage": 63,
      "caption": "3.4.2 - Condizioni di carico per coperture ad una falda",
      "alt": "Condizione di carico della neve per una copertura ad una falda.",
      "imagePath": "figures/ntc2018/fig3.4.2.png",
      "region": {
        "coordinateSystem": "pdf-points-top-left",
        "x": 268.333,
        "y": 186,
        "width": 69.667,
        "height": 69.667
      },
      "sha256": "5a8b2af5442134142a562e15b66bdeea2d7f1bdb9da74e0bb0a7c5d091fc9ce5"
    },
    {
      "id": "urn:structural-codes:it:asset:figure:ntc2018:3.4.3",
      "unitId": "urn:structural-codes:it:unit:ntc2018:3.4.3.3",
      "officialNumber": "3.4.3",
      "pdfPage": 63,
      "caption": "3.4.3 - Condizioni di carico per coperture a due falde",
      "alt": "Tre condizioni alternative di carico della neve per una copertura a due falde.",
      "imagePath": "figures/ntc2018/fig3.4.3.png",
      "region": {
        "coordinateSystem": "pdf-points-top-left",
        "x": 213.667,
        "y": 315,
        "width": 161.667,
        "height": 102.667
      },
      "sha256": "d7dca5d813c75a7a9504f87487a27d87f919ea5d5d2e5d23ea04f45b3a42ef08"
    },
    {
      "id": "urn:structural-codes:it:asset:figure:ntc2018:3.5.1",
      "unitId": "urn:structural-codes:it:unit:ntc2018:3.5.2",
      "officialNumber": "3.5.1",
      "pdfPage": 64,
      "caption": "3.5.1 - Zone della temperatura dell’aria esterna.",
      "alt": "Mappa delle quattro zone italiane della temperatura dell'aria esterna.",
      "imagePath": "figures/ntc2018/fig3.5.1.png",
      "region": {
        "coordinateSystem": "pdf-points-top-left",
        "x": 227.667,
        "y": 242,
        "width": 143.333,
        "height": 198
      },
      "sha256": "d85d71483109aedab78b6c35dba97367fb99c2918b01a3ec9a0ce44d22e2f108"
    },
    {
      "id": "urn:structural-codes:it:asset:figure:ntc2018:3.5.2",
      "unitId": "urn:structural-codes:it:unit:ntc2018:3.5.4",
      "officialNumber": "3.5.2",
      "pdfPage": 65,
      "caption": "3.5.2 - Andamento della temperatura all’interno di un elemento strutturale",
      "alt": "Andamento della temperatura attraverso materiale isolante ed elemento strutturale.",
      "imagePath": "figures/ntc2018/fig3.5.2.png",
      "region": {
        "coordinateSystem": "pdf-points-top-left",
        "x": 187.333,
        "y": 280,
        "width": 220.333,
        "height": 140.667
      },
      "sha256": "b58072d93ce9622496e97cc8dc7cff1200089757c3c771f057a333db60c315e0"
    }
  ]
}
