{
  "$schema": "urn:structural-codes:schema:asset-manifest:v2",
  "schemaVersion": "2.0.0-alpha.2",
  "recordType": "asset-manifest",
  "document": "circ2019",
  "section": "C4.2-step2s",
  "sourceId": "circ-7-2019",
  "status": "verified",
  "formulas": [
    {
      "id": "urn:structural-codes:it:asset:formula:circ2019:c4.2.101",
      "unitId": "urn:structural-codes:it:unit:circ2019:c4.2.12.1.1",
      "officialNumber": "C4.2.101",
      "pdfPage": 135,
      "latex": "f_{myk}=f_{yk}+\\frac{(f_{tk}-f_{yk})\\cdot k\\cdot n\\cdot t^2}{A_g}\\le0{,}5\\cdot(f_{tk}+f_{yk})"
    }
  ],
  "tables": [],
  "figures": []
}
